codigo,clasificacion
W83,Otras obstrucciones especificadas de la respiración
E70,Trastornos del metabolismo de los aminoácidos aromáticos
O62,Anormalidades de la dinámica del trabajo de parto
K63,Otras enfermedades de los intestinos
E41,Marasmo nutricional
W76,Otros estrangulamientos y ahorcamientos accidentales
G35,Esclerosis múltiple
K90,Malabsorción intestinal
K31,Otras enfermedades del estómago y del duodeno
A53,Otras sífilis y las no especificadas
X62,"Envenenamiento autoinfligido intencionalmente por, y exposición a narcóticos y psicodislépticos [alucinógenos], no clasificados en otra parte"
J94,Otras afecciones de la pleura
X79,Lesión autoinfligida intencionalmente por objeto romo o sin filo
M87,Osteonecrosis
M89,Otros trastornos del hueso
Y86,Secuelas de otros accidentes
N00,Síndrome nefrítico agudo
W36,Explosión y rotura de cilindro con gas
W37,"Explosión y rotura de neumático, tubo o manguera de goma presurizada"
E05,Tirotoxicosis [hipertiroidismo]
L29,Prurito
V69,"Ocupante de vehículo de transporte pesado lesionado en otros accidentes de transporte, y en los no especificados"
D37,Tumor de comportamiento incierto o desconocido de la cavidad bucal y de los órganos digestivos
W49,"Exposición a otras fuerzas mecánicas inanimadas, y las no especificadas"
Y16,"Envenenamiento por, y exposición a disolventes orgánicos e hidrocarburos halogenados y sus vapores, de intención no determinada"
E80,Trastornos del metabolismo de las porfirinas y de la bilirrubina
V33,"Ocupante de vehículo de motor de tres ruedas lesionado por colisión con automóvil, camioneta o furgoneta"
D47,"Otros tumores de comportamiento incierto o desconocido del tejido linfático, de los órganos hematopoyéticos y de tejidos afines"
E83,Trastornos del metabolismo de los minerales
D38,Tumor de comportamiento incierto o desconocido del oído medio y de los órganos respiratorios e intratorácicos
Q25,Malformaciones congénitas de las grandes arterias
I28,Otras enfermedades de los vasos pulmonares
D22,Nevo melanocítico
Q23,Malformaciones congénitas de las válvulas aórtica y mitral
C02,Tumor maligno de otras partes y de las no especificadas de la lengua
G08,Flebitis y tromboflebitis intracraneal e intrarraquídea
L97,"Úlcera de miembro inferior, no clasificada en otra parte"
R92,Hallazgos anormales en diagnóstico por imagen de la mama
O42,Ruptura prematura de las membranas
C23,Tumor maligno de la vesícula biliar
G61,Polineuopatía inflamatoria
V82,Ocupante de tranvía lesionado en accidente de transporte
I40,Miocarditis aguda
E16,Otros trastornos de la secreción interna del páncreas
C15,Tumor maligno del esófago
C46,Sarcoma de Kaposi
V32,Ocupante de vehículo de motor de tres ruedas lesionado por colisión con otro vehículo de motor de dos o tres ruedas
I95,Hipotensión
X28,Contacto traumático con otras plantas venenosas especificadas
I11,Enfermedad cardíaca hipertensiva
G62,Otras polineuropatías
D35,Tumor benigno de otras glándulas endocrinas y de las no especificadas
Q92,"Otras trisomías y trisomías parciales de los autosomas, no clasificadas en otra parte"
V88,"Accidente no de tránsito de tipo especificado, pero donde se desconoce el modo de transporte de la víctima"
Q98,"Otras anomalías de los cromosomas sexuales, con fenotipo masculino, no clasificadas en otra parte"
E24,Síndrome de Cushing
R45,Síntomas y signos que involucran el estado emocional
B89,"Enfermedad parasitaria, no especificada"
R50,Fiebre de otro origen y de origen desconocido
C37,Tumor maligno del timo
D39,Tumor de comportamiento incierto o desconocido de los órganos genitales femeninos
B94,Secuelas de otras enfermedades infecciosas y parasitarias de los no especificadas
B99,Otras enfermedades infecciosas y las no especificadas
V91,Accidente de embarcación que causa otros tipos de traumatismo
E42,Kwashiorkor marasmático
C32,Tumor maligno de la laringe
X29,Contacto traumático con animales y plantas venenosos no especificados
N83,"Tratornos no inflamatorios del ovario, de la trompa de Falopio y del ligamento ancho"
F17,Trastornos mentales y del comportamiento debidos al uso de tabaco
X58,Exposición a otros factores especificados
F06,"Otros trastornos mentales debidos a lesión y disfunción cerebral, y a enfermedad física"
A81,Infecciones del sistema nervioso central por virus atípico
Y85,Secuelas de accidentes de transporte
Y87,"Secuelas de lesiones autoinfligidas intencionalmente, agresiones y eventos de intención no determinada"
W02,"Caída por patines para hielo, esquís, patines de ruedas o patineta"
W03,Otras caídas en el mismo nivel por colisión con o por empujón de otra persona
F19,Trastornos mentales y del comportamiento debidos al uso de múltiples drogas y al uso de otras sustancias psicoactivas
Y65,Otros incidentes durante la atención médica y quirúrgica
J09,Influenza debida a ciertos virus de la influenza identificados
I70,Aterosclerosis
A89,"Infección viral del sistema nervioso central, no especificada"
Y03,Agresión por colisión de vehículo de motor
O13,Hipertensión gestacional [inducida por el embarazo]
L51,Eritema multiforme
F23,Trastornos psicóticos agudos y transitorios
W12,Caída en o desde andamio
V77,Ocupante de autobús lesionado por colisión con objeto fijo o estacionado
W65,Ahogamiento y sumersión mientras se está en la bañera
Y05,Agresión sexual con fuerza corporal
F39,"Trastorno del humor [afectivo], no especificado"
O23,Infección de las vías genitourinarias en el embarazo
B16,Hepatitis aguda tipo B
V56,Ocupante de camioneta o furgoneta lesionado por colisión con otros vehículos sin motor
C21,Tumor maligno del ano y del conducto anal
A05,"Otras intoxicaciones alimentarias bacterianas, no clasificadas en otra parte"
V93,"Accidente en una embarcación, sin accidente a la embarcación, que no causa ahogamiento o sumersión"
A48,"Otras enfermedades bacterianas, no clasificadas en otra parte"
W91,Exposición a radiación de tipo no especificado
G20,Enfermedad de Parkinson
D66,Deficiencia hereditaria del factor VIII
D57,Trastornos falciformes
I73,Otras enfermedades vasculares periféricas
Q75,Otras malformaciones congénitas de los huesos del cráneo y de la cara
J92,Paquipleuritis
I83,Venas varicosas de los miembros inferiores
W26,"Contacto traumático con cuchillo, espada, daga o puñal"
Y27,"Contacto con vapor de agua, vapores y objetos calientes, de intención no determinada"
I48,Fibrilación y aleteo auricular
A69,Otras infecciones causadas por espiroquetas
W01,"Caída en el mismo nivel por deslizamiento, tropezón y traspié"
D53,Otras anemias nutricionales
N31,"Disfunción neuromuscular de la vejiga, no clasificada en otra parte"
A96,Fiebre hemorrágica por arenavirus
Q82,Otras malformaciones congénitas de la piel
V75,Ocupante de autobús lesionado por colisión con tren o vehículo de rieles
C39,Tumor maligno de otros sitios y de los mal definidos del sistema respiratorio y de los órganos intratorácicos
B15,Hepatitis aguda tipo A
E15,Coma hipoglicémico no diabético
E31,Disfunción poliglandular
E51,Deficiencia de tiamina
F73,Retraso mental profundo
B18,Hepatitis viral crónica
X23,"Contacto traumático con avispones, avispas y abejas"
B55,Leishmaniasis
O75,"Otras complicaciones del trabajo de parto y del parto, no clasificadas en otra parte"
X01,Exposición a fuego no controlado en lugar que no es edificio u otra construcción
W27,Contacto traumático con herramientas manuales sin motor
I20,Angina de pecho
V52,Ocupante de camioneta  o furgoneta lesionado por colisión con vehículo de motor de dos o tres ruedas
Y81,Dispositivos de cirugía general y plástica asociados con incidentes adversos
Q15,Otras malformaciones congénitas del ojo
J68,"Afecciones respiratorias debidas a inhalación de gases, humos, vapores y sustancias químicas"
N11,Nefritis  tubulointersticial crónica
E45,Retardo del desarrollo debido a desnutrición proteicocalórica
W07,Caída que implica silla
I89,Otros trastornos no infecciosos de los vasos y ganglios linfáticos
Y80,Aparatos de medicina física asociados con incidentes adversos
F89,"Trastorno del desarrollo psicológico, no especificado"
K46,Hernia no especificada de la cavidad abdominal
M67,Otros trastornos de la sinovia y del tendón
D15,Tumor benigno de otros órganos intratorácicos y de los no especificados
C45,Mesotelioma
N34,Uretritis y síndrome uretral
N94,Dolor y otras afecciones relacionadas con los órganos genitales femeninos y con el ciclo menstrual
J40,"Bronquitis, no especificada como aguda o crónica"
R18,Ascitis
F72,Retraso mental grave
N21,Cálculo de las vías urinarias inferiores
B75,Triquinosis
K61,Absceso de las regiones anal y rectal
J34,Otros trastornos de la nariz y de los senos paranasales
K30,Dispepsia funcional
X65,"Envenenamiento autoinfligido intencionalmente por, y exposición al alcohol"
N70,Salpingitis y ooforitis
Y82,"Otros dispositivos médicos, y los no especificados, asociados con incidentes adversos"
Y42,"Efectos adversos de hormonas y sus sustitutos sintéticos y antagonistas, no clasificados en otra parte"
O97,Muerte por secuelas de causas obstétricas
J04,Laringitis y traqueítis agudas
A91,Fiebre del dengue hemorrágico
C77,Tumor maligno secundario y el no especificado de los ganglios linfáticos
O68,Trabajo de parto y parto complicados por sufrimiento fetal
X08,"Exposición a otros humos, fuegos o llamas especificados"
J21,Bronquiolitis aguda
K52,Otras colitis y gastroenteritis no infecciosas
X16,"Contacto con radiadores, cañerías y artefactos para calefacción, calientes"
E03,Otros hipotiroidismos
W89,"Exposición a fuente de luz visible y ultravioleta, de origen artificial"
N26,"Riñón contraído, no especificado"
N13,Uropatía obstructiva y por reflujo
J00,Rinofaringitis aguda [resfriado común]
Y75,Dispositivos neurológicos asociados con incidentes adversos
X60,"Envenenamiento autoinfligido intencionalmente por, y exposición a analgésicos no narcóticos, antipiréticos y antirreumáticos"
L94,Otros trastornos localizados del tejido conjuntivo
J06,"Infecciones agudas de las vías respiratorias superiores, de sitios múltiples o no especificados"
V85,Ocupante de vehículo especial (de motor) para construcción lesionado en accidente de transporte
X24,Contacto traumático con centípodos y miriápodos venenosos (tropicales)
G60,Neuropatía hereditaria e idiopática
X30,Exposición al calor natural excesivo
R59,Adenomegalia
Y41,Efectos adversos de otros antiinfecciosos y antiparasitarios sistémicos
B59,Neumocistosis
O16,"Hipertensión materna, no especificada"
I13,Enfermedad cardiorrenal hipertensiva
W50,"Aporreo, golpe, mordedura, patada, rasguño o torcedura infligidos por otra persona"
X41,"Envenenamiento accidental por, y exposición a drogas antiepilépticas, sedantes, hipnóticas, antiparkinsonianas y psicotrópicas, no clasificadas en otra parte"
F32,Episodio depresivo
O07,Intento fallido de aborto
J62,Neumoconiosis debida a polvo de sílice
W44,Cuerpo extraño que penetra por el ojo u orificio natural
C58,Tumor maligno de la placenta
B34,Infección viral de sitio no especificado
Y02,Agresión por empujar o colocar a la víctima delante de objeto en movimiento
N10,Nefritis tubulointersticial aguda
O46,"Hemorragia anteparto, no clasificada en otra parte"
A44,Bartonelosis
A04,Otras infecciones intestinales bacterianas
O24,Diabetes mellitus en el embarazo
J13,Neumonía debida a Streptococcus pneumoniae
R22,"Tumefacción, masa  o prominencia de la piel y del tejido subcutáneo localizados"
C03,Tumor maligno de la encía
F50,Trastornos de la ingestión de alimentos
K04,Enfermedades de la pulpa y de los tejidos periapicales
V41,Ocupante de automóvil lesionado por colisión con vehículo de pedal
K82,Otras enfermedades de la vesícula biliar
V38,Ocupante de vehículo de motor de tres ruedas lesionado en accidente de transporte sin colisión
A99,"Fiebre viral hemorrágica, no especificada"
G44,Otros síndromes de cefalea
D80,Inmunodeficiencia con predominio de defectos de los anticuerpos
V06,Peatón lesionado por colisión con otros vehículos sin motor
B83,Otros helmintiasis
C19,Tumor maligno de la unión rectosigmoidea
W06,Caída que implica cama
X05,Exposición a ignición o fusión de ropas de dormir
M84,Trastornos de la continuidad del hueso
B69,Cisticercosis
M92,Otras osteocondrosis juveniles
O04,Aborto médico
V61,Ocupante de vehículo de transporte pesado lesionado por colisión con vehículo de pedal
F28,Otros trastornos psicóticos  de origen no orgánico
V39,"Ocupante de vehículo de motor de tres ruedas lesionado en otros accidentes de transporte, y en los no especificados"
F78,Otros tipos de retraso mental
C66,Tumor maligno del uréter
G25,Otros trastornos extrapiramidales y del movimiento
C10,Tumor maligno de la orofaringe
F31,Trastorno afectivo bipolar
M81,Osteoporosis sin fractura patológica
G47,Trastornos del sueño
Y48,Efectos adversos de gases anestésicos y terapéuticos
V67,Ocupante de vehículo de transporte pesado lesionado por colisión con objeto fijo o estacionado
K43,Hernia ventral
A06,Amebiasis
D56,Talasemia
D25,Leiomioma del útero
B49,"Micosis, no especificada"
W94,Exposición a presión de aire alta y baja y a cambios en la presión del aire
B88,Otras infestaciones
Y69,Incidentes no especificados durante la atención médica y quirúrgica
R63,Síntomas y signos concernientes a la alimentación y a la ingestión de líquidos
V72,Ocupante de autobús lesionado por colisión con vehículo de motor de dos o tres ruedas
J36,Absceso periamigdalino
I87,Otros trastornos de las venas
L88,Pioderma gangrenoso
C88,Otros linfomas de células B [enfermedades inmunoproliferativas malignas]
D45,Policitemia vera
B90,Secuelas de tuberculosis
R53,Malestar y fatiga
Q39,Malformaciones congénitas del esófago
A85,"Otras encefalitis virales, no clasificadas en otra parte"
X38,Víctima de inundación
E13,Otras diabetes mellitus especificadas
O11,Preeclampsia superpuesta en hipertensión crónica
Q83,Malformaciones congénitas de la mama
G54,Trastornos de las raíces y de los plexos nerviosos
X88,Agresión con gases y vapores
O74,Complicaciones de la anestesia administrada durante el trabajo de parto y el parto
Y06,Negligencia y abandono
V94,"Otros accidentes de transporte por agua, y los no especificados"
X25,Contacto traumático con otros artrópodos venenosos
K45,Otras hernias de la cavidad abdominal
Y13,"Envenenamiento por, y exposición a otras drogas que actúan sobre el sistema nervioso autónomo, de intención no determinada"
X34,Víctima de terremoto
D67,Deficiencia hereditaria del factor IX
F01,Demencia vascular
B54,Paludismo [malaria] no especificado
Q74,Otras anomalías congénitas del (de los) miembro(s)
L95,"Vasculitis limitada a la piel, no clasificada en otra parte"
X03,Exposición a fuego controlado en lugar que no es edificio u otra construcción
I06,Enfermedades reumáticas de la válvula aórtica
X77,"Lesión autoinfligida intencionalmente por vapor de agua, vapores y objetos calientes"
F09,"Trastorno mental orgánico o sintomático, no especificado"
C13,Tumor maligno de la hipofaringe
R85,Hallazgos anormales en muestras tomadas de órganos digestivos y de la cavidad abdominal
M76,"Entesopatías del miembro inferior, excluido el pie"
Y60,"Corte, punción, perforación o hemorragia no intencional durante la atención médica y quirúrgica"
M48,Otras espondilopatías
E12,Diabetes mellitus asociada con desnutrición
F41,Otros trastornos de ansiedad
Q01,Encefalocele
K08,Otros trastornos de los dientes y de sus estructuras de sostén
O89,Complicaciones de la anestesia administrada durante el puerperio
M51,Otros trastornos de los discos intervertebrales
D06,Carcinoma in situ del cuello del útero
D11,Tumor benigno de las glándulas salivales mayores
X43,"Envenenamiento accidental por, y exposición a otras drogas que actúan sobre el sistema nervioso autónomo"
H70,Mastoiditis y afecciones relacionadas
W28,"Contacto traumático con cortadora de césped, con motor"
M05,Artritis reumatoide seropositiva
N82,Fístulas que afectan el tracto genital femenino
J33,Pólipo nasal
L01,Impétigo
V11,Ciclista lesionado por colisión con otro ciclista
F05,"Delirio, no inducido por alcohol o por otras sustancias psicoactivas"
J02,Faringitis aguda
A84,Encefalitis viral transmitida por garrapatas
A02,Otras infecciones debidas a Salmonella
B02,Herpes zoster
O61,Fracaso de la inducción del trabajo de parto
W04,Caída al ser trasladado o sostenido por otras personas
H11,Otros trastornos de la conjuntiva
M95,Otras deformidades adquiridas del sistema osteomuscular y del tejido conjuntivo
Y74,Dispositivos para uso hospitalario general y personal asociados con incidentes adversos
X40,"Envenenamiento accidental por, y exposición a analgésicos no narcóticos, antipiréticos y antirreumáticos"
O91,Infecciones de la mama asociadas con el parto
Y46,Efectos adversos de drogas antiepilépticas y antiparkinsonianas
Y49,Efectos adversos de drogas psicotrópicas no especificadas en otra parte
R31,"Hematuria, no especificada"
V30,Ocupante de vehículo de motor de tres ruedas lesionado por colisión con peatón o animal
N75,Enfermedades de la glándula de Bartholin
V16,Ciclista lesionado por colisión con otros vehículos sin motor
D09,Carcinoma in situ de otros sitios y de los no especificados
N01,Síndrome nefrítico rápidamente progresivo
D02,Carcinoma in situ del sistema respiratorio y del oído medio
B26,Parotiditis infecciosa
Q97,"Otras anomalías de los cromosomas sexuales, con fenotipo femenino, no clasificadas en otra parte"
F30,Episodio maníaco
D24,Tumor benigno de la mama
O35,"Atención materna por anormalidad o lesión fetal, conocida o presunta"
L52,Eritema nudoso
D17,Tumores benignos lipomatosos
J60,Neumoconiosis de los mineros del carbón
I01,Fiebre reumática con complicación cardíaca
A70,Infeccion debida a Chlamydia psittaci
H18,Otros trastornos de la córnea
K07,Anomalías dentofaciales (incluso la maloclusión)
R62,Falta del desarrollo fisiológico normal esperado
J35,Enfermedades crónicas de las amígdalas y de las adenoides
E44,Desnutrición proteicocalórica de grado moderado y leve
N61,Trastornos inflamatorios de la mama
B91,Secuelas de poliomielitis
X86,Agresión con sustancia corrosiva
J05,Laringitis obstructiva aguda [crup] y epiglotitis
I86,Várices de otros sitios
A64,Enfermedad de transmisión sexual no especificada
M19,Otras artrosis
J82,"Eosinofilia pulmonar, no clasificada en otra parte"
G45,Ataques de isquemia cerebral transitoria y síndromes afines
V51,Ocupante de camioneta o furgoneta lesionado por colisión con vehículo de pedal
D55,Anemia debida a trastornos enzimáticos
Q86,"Síndromes de malformaciones congénitas debidos a causas exógenas conocidas, no clasificados en otra parte"
N48,Otros trastornos del pene
N14,Afecciones tubulares y tubulointersticiales inducidas por drogas y por metales pesados
N89,Otros trastornos no inflamatorios de la vagina
R93,Hallazgos anormales en diagnóstico por imagen de otras estructuras del cuerpo
J61,Neumoconiosis debida al asbesto y a otras fibras minerales
D03,Melanoma in situ
Q18,Otras malformaciones congénitas del la cara y del cuello
Q72,Defectos por reducción del miembro inferior
E00,Síndrome congénito de deficiencia de yodo
V66,Ocupante de vehículo de transporte pesado lesionado por colisión con otros vehículos sin motor
M94,Otros trastornos del cartílago
B74,Filariasis
Y52,Efectos adversos de agentes que afectan primariamente el sistema cardiovascular
F82,Trastorno especÍfico del desarrollo de la función motriz
M25,"Otros trastornos articulares, no clasificados en otra parte"
X17,"Contacto con máquinas, motores y herramientas calientes"
H20,Iridociclitis
L87,Trastornos de la eliminación transepidérmica
L60,Trastornos de las uñas
Q71,Defectos por reducción del miembro superior
M70,"Trastornos de los tejidos blandos relacionados con el uso, el uso excesivo y la presión"
B82,"Parasitosis intestinal, sin otra especificación"
M15,Poliartrosis
N42,Otros trastornos de la próstata
B66,Otras infecciones debidas a trematodos
W39,Explosión de fueros artificiales
L26,Dermatitis exfoliativa
X27,Contacto traumático con otros animales venenosos especificados
A60,Infección anogenital debida a virus del herpes [herpes simple]
M47,Espondilosis
M10,Gota
M16,Coxartrosis [artrosis de la cadera]
K36,Otros tipos de apendicitis
K10,Otras enfermedades de los maxilares
Q34,Otras malformaciones congénitas del sistema respiratorio
D20,Tumor benigno del tejido blando del peritoneo y del retroperitoneo
F13,Trastornos mentales y del comportamiento debidos al uso de sedantes  o hipnóticos
R01,Soplos y otros sonidos cardíacos
D27,Tumor benigno del ovario
W93,Exposición a frío excesivo de origen artificial
N62,Hipertrofia de la mama
X18,Contacto con otros metales calientes
X26,Contacto traumático con animales y plantas marinas venenosos
V98,Otros accidentes de transporte especificados
R86,Hallazgos anormales en muestras tomadas de órganos genitales masculinos
K28,Úlcera gastroyeyunal
N45,Orquitis y epididimitis
N50,Otros trastornos de los órganos genitales masculinos
R91,Hallazgos anormales en diagnóstico por imagen del pulmón
R52,"Dolor, no clasificado en otra parte"
N63,Masa no especificada en la mama
Q42,"Ausencia, atresia y estenosis congénita del intestino grueso"
M54,Dorsalgia
D34,Tumor benigno de la glándula tiroides
E53,Deficiencias de otras vitaminas del grupo B
F25,Trastornos esquizoafectivos
X14,Contacto con aire y gases calientes
L80,Vitíligo
X57,Privación no especificada
E55,Deficiencia de vitamina D
H92,Otalgia y secreción del oído
N47,"Prepucio redundante, fimosis y parafimosis"
D52,Anemia por deficiencia de folatos
L27,Dermatitis debida a sustancias ingeridas
M71,Otras bursopatías
R61,Hiperhidrosis
G64,Otros trastornos del sistema nervioso periférico
A23,Brucelosis
F68,Otros trastornos de la personalidad y del comportamiento en adultos
L84,Callos y callosidades
F04,"Síndrome amnésico orgánico, no inducido por alcohol o por otras sustancias psicoactivas"
R87,Hallazgos anormales en muestras tomadas de órganos genitales femeninos
L42,Pitiriasis rosada
L21,Dermatitis seborreica
N60,Displasia mamaria benigna
R46,Síntomas y signos que involucran la apariencia y el comportamiento
A37,Tos ferina [tos convulsiva]
F38,Otros trastornos del humor [afectivos]
F51,Trastornos no orgánicos del sueño
F62,"Cambios perdurables de la personalidad, no atribuibles a lesión o a enfermedad cerebral"
F65,Trastornos de la preferencia sexual
F66,Trastornos psicológicos y del comportamiento asociados con el desarrollo y con la orientación sexuales
A55,Linfogranuloma (venéreo) por clamidias
A71,Tracoma
L57,Cambios de la piel debidos a exposición crónica a radiación no ionizante
Y36,Operaciones de guerra
Y61,Objeto extraño dejado accidentalmente en el cuerpo durante la atención médica y quirúrgica
R71,Anormalidad de los eritrocitos
G51,Trastornos del nervio facial
B64,"Enfermedad debida a protozoarios, no especificada"
H31,Otros trastornos de la coroides
W92,Exposición a calor excesivo de origen artificial
R30,Dolor asociado con la micción
R39,Otros síntomas y signos que involucran el sistema urinario
L20,Dermatitis atópica
L65,Otra pérdida no cicatricial del pelo
L91,Trastornos hipertróficos de la piel
N35,Estrechez uretral
R70,Velocidad de eritrosedimentación elevada y otras anormalidades de la viscosidad del plasma
M22,Trastornos de la rótula
K03,Otras enfermedades de los tejidos duros de los dientes
K09,"Quites de la región bucal, no clasificados en otra parte"
W08,Caída que implica otro mueble
N90,Otros trastornos no inflamatorios de la vulva y del perineo
Q45,Otras malformaciones congénitas del sistema digestivo
R95,Síndrome de la muerte súbita infantil
P00,Feto y recién nacido afectado por condiciones de la madre no necesariamente relacionadas con el embarazo presente
P91,Otras alteraciones cerebrales del recién nacido
P21,Asfixia del nacimiento
P23,Neumonía congénita
P01,Feto y recién nacido afectados por complicaciones maternas del embarazo
P02,"Feto y recién nacido afectado por complicaciones de la placenta, del cordón umbilical y de las membranas"
Q00,Anencefalia y malformaciones congénitas similares
P03,Feto y recién nacido afectados por otras complicaciones del trabajo de parto y del parto
P26,Hemorragia pulmonar originada en el período perinatal
P77,Enterocolitis necrotizante del feto y del recién nacido
Q63,Otras malformaciones congénitas del riñón
P94,Trastornos del tono muscular del recién nacido
P27,Enfermedad respiratoria crónica originada en el período perinatal
P78,Otros trastornos perinatales del sistema digestivo
Q55,Otras malformaciones congénitas de los órganos genitales masculinos
Q35,Fisura del paladar
Q36,Labio leporino
P70,Trastornos transitorios del metabolismo de los carbohidratos específicos del feto y del recién nacido
P37,Otras enfermedades infecciosas y parasitarias congénitas
P59,Ictericia neonatal por otras causas y por las no especificadas
P04,Feto y recién nacido afectados por influencias nocivas transmitidas a través de la placenta o de la leche materna
P74,Otras alteraciones metabólicas y electrolíticas neonatales transitorias
P90,Convulsiones del recién nacido
R83,Hallazgos anormales en el líquido cefalorraquídeo
Q37,Fisura del paladar con labio leporino
Q56,Sexo indeterminado y seudohermafroditismo
Q68,Otras deformidades osteomusculares congénitas
Q52,Otras malformaciones congénitas de los órganos genitales femeninos
P51,Hemorragia umbilical del recién nacido
P10,Hemorragia y laceración intracraneal debidas a traumatismo del nacimiento
P72,Otros trastornos endocrinos neonatales transitorios
D74,Metahemoglobinemia
H35,Otros trastornos de la retina
W88,Exposición a radiación ionizante
Q13,Malformaciones congénitas del segmento anterior del ojo
