codigo,clasificacion
F12,Trastornos mentales y del comportamiento debidos al uso de cannabinoides
A22,Carbunco [ántrax]
N03,Síndrome nefrítico crónico
G90,Trastornos del sistema nervioso autónomo
J37,Laringitis y laringotraqueítis crónicas
K40,Hernia inguinal
K64,Hemorroides y trombosis venosa perianal
F16,Trastornos mentales y del comportamiento debidos al uso de alucinógenos
V15,Ciclista lesionado por colisión con tren o vehículo de rieles
F07,"Trastronos de la personalidad y del comportamiento debidos a enfermedad, lesión o disfunción cerebral"
A87,Meningitis viral
Q62,Defectos obstructivos congénitos de la pelvis renal y malformaciones congénitas del uréter
Y71,Dispositivos cardiovasculares asociados con incidentes adversos
B27,Mononucleosis infecciosa
D07,Carcinoma in situ de otros órganos genitales y de los no especificados
D26,Otros tumores benignos del útero
D51,Anemia por deficiencia de vitamina B12
I02,Corea reumática
M85,Otros trastornos de la densidad y de la estructura óseas
E67,Otros tipos de hiperalimentación
E04,Otros bocios no tóxicos
I88,Linfadenitis inespecífica
R23,Otros cambios en la piel
M24,Otros trastornos articulares específicos
N81,Prolapso genital femenino
N85,"Otros trastornos no inflamatorios del útero, excepto del cuello"
N98,Complicaciones asociadas con la fecundación artificial
E63,Otras deficiencias nutricionales
F45,Trastornos somatomorfos
L13,Otros trastornos flictenulares
L40,Psoriasis
B48,"Otras micosis, no clasificadas en otra parte"
L81,Otros trastornos de la pigmentación
Q32,Malformaciones congénitas de la tráquea y de los bronquios
M02,Artropatías reactivas
N20,Cálculo del riñón y del uréter
N23,"Cólico renal, no especificado"
Y40,Efectos adversos de antibióticos sistémicos
Y45,"Efectos adversos de drogas analgésicas, antipiréticas y antiinflamatorias"
E77,Trastornos del metabolismo de las glucoproteínas
C33,Tumor maligno de la tráquea
M60,Miositis
J14,Neumonía debida a Haemophilus influenzae
X10,"Contacto con bebidas, alimentos, grasas y aceites para cocinar, calientes"
R17,Ictericia no especificada
R73,Nivel elevado de glucosa en sangre
K05,Gingivitis y enfermedades periodontales
N93,Otras hemorragias uterinas o vaginales anormales
I36,Trastornos no reumáticos de la válvula tricúspide
Y73,Dispositivos de gastroenterología y urología asociados con incidentes adversos
F70,Retraso mental leve
O70,Desgarro perineal durante el parto
W41,Exposición a chorro de alta presión
Y62,Fallas en la esterilización durante la atención médica y quirúrgica
M46,Otras espondilopatías inflamatorias
B36,Otras micosis superficiales
L90,Trastornos atróficos de la piel
G81,Hemiplejía
N80,Endometriosis
Y55,Efectos adversos de agentes que actúan primariamente sobre los músculos lisos y estriados y sobre el sistema respiratorio
E50,Deficiencia de vitamina A
X54,Privación de agua
W52,"Persona aplastada, empujada o pisoteada por una multitud o estampida humana"
D00,"Carcinoma in situ de la cavidad bucal, del esófago y del estómago"
D01,Carcinoma in situ de otros órganos digestivos y de los no especificados
V10,Ciclista lesionado por colisión con peatón o animal
M83,Osteomalacia del adulto
A43,Nocardiosis
Q31,Malformaciones congénitas de la laringe
R60,"Edema, no clasificado en otra parte"
J30,Rinitis alérgica y vasomotora
G43,Migraña
R16,"Hepatomegalia y esplenomegalia, no clasificadas en otra parte"
A46,Erisipela
M17,Gonartrosis [artrosis de la rodilla]
R47,"Alteraciones del habla, no clasificadas en otra parte"
J65,Neumoconiosis asociada con tuberculosis
M23,Trastorno interno de la rodilla
K38,Otras enfermedades del apéndice
N44,Torsión del testículo
D19,Tumores benignos del tejido mesotelial
N06,Proteinuria aislada con lesión morfológica especificada
O34,Atención materna por anormalidades conocidas o presuntas de los órganos pelvianos de la madre
K13,Otras enfermedades de los labios y de la mucosa bucal
D30,Tumor benigno de los órganos urinarios
D50,Anemias por deficiencia de hierro
V60,Ocupante de vehículo de transporte pesado lesionado por colisión con peatón o animal
E06,Tiroiditis
R90,Hallazgos anormales en diagnóstico por imagen del sistema nervioso central
R27,Otras fallas de coordinación
J41,Bronquitis crónica simple y mucopurulenta
L70,Acné
N07,Nefropatía hereditaria no clasificada en otra parte
B04,Viruela de los monos
B40,Blastomicosis
L00,Síndrome estafilocócico de la piel escaldada
A54,Infección gonocócica
M61,Calcificación y osificación del músculo
G56,Mononeuropatías del miembro superior
L50,Urticaria
M80,Osteoporosis con fractura patológica
J01,Sinusitis aguda
E52,Deficiencia de niacina [pelagra]
I15,Hipertensión secundaria
I22,Infarto subsecuente del miocardio
L85,Otros tipos de engrosamiento epidérmico
H72,Perforación de la membrana timpánica
F60,Trastornos específicos de la personalidad
R19,Otros síntomas y signos que involucran el sistema digestivo y el abdomen
Y79,Dispositivos ortopédicos asociados con incidentes adversos
A59,Tricomoniasis
F43,Reacción al estrés grave y trastornos de adaptación
B86,Escabiosis
N84,Pólipo del tracto genital femenino
N95,Otros trastornos menopáusicos y perimenopáusicos
M53,"Otras dorsopatías, no clasificadas en otra parte"
D62,Anemia posthemorrágica aguda
B43,Cromomicosis y absceso feomicótico
M93,Otras osteocondropatías
G52,Trastornos de otros nervios craneales
C12,Tumor maligno del seno piriforme
D31,Tumor benigno del ojo y sus anexos
K58,Síndrome del colon irritable
M99,"Lesiones biomecánicas, no clasificadas en otra parte"
L30,Otras dermatitis
L05,Quiste pilonidal
K41,Hernia femoral
M50,Trastornos de disco cervical
D04,Carcinoma in situ de la piel
G50,Trastornos del nervio trigémino
H44,Trastornos del globo ocular
L41,Parapsoriasis
A21,Tularemia
V31,Ocupante de vehículo de motor de tres ruedas lesionado por colisión con vehículo de pedal
L28,Liquen simple crónico y prurigo
N88,Otros trastornos no inflamatorios del cuello del útero
A83,Encefalitis viral transmitida por mosquitos
N40,Hiperplasia de la próstata
R72,"Anormalidades de los leucocitos, no clasificadas en otra parte"
J32,Sinusitis crónica
N72,Enfermedad inflamatoria del cuello uterino
F40,Trastornos fóbicos de ansiedad
F44,Trastornos disociativos [de conversión]
D28,Tumor benigno de otros órganos genitales femeninos y de los no especificados
J66,Enfermedades de las vías aéreas debidas a polvos orgánicos específicos
X39,"Exposición a otras fuerzas de la naturaleza, y las no especificadas"
A94,"Fiebre viral transmitida por artrópodos, no especificada"
F42,Trastorno obsesivo-compulsivo
B05,Sarampión
Y54,Efectos adversos de agentes que afectan primariamente el equilibrio hídrico y el metabolismo mineral y del ácido úrico
R11,Náusea y vómito
N41,Enfermedades inflamatorias de la próstata
H81,Trastornos de la función vestibular
R13,Disfagia
R54,Senilidad
N36,Otros trastornos de la uretra
Y72,Dispositivos otorrinolaringológicos asociados con incidentes adversos
E58,Deficiencia dietética de calcio
R76,Otros hallazgos inmunológicos anormales en suero
A42,Actinomicosis
R34,Anuria y oliguria
D29,Tumor benigno de los órganos genitales masculinos
B76,Anquilostomiasis y necatoriasis
F33,Trastorno depresivo recurrente
A03,Shigelosis
L68,Hipertricosis
L73,Otros trastornos foliculares
K14,Enfermedades de la lengua
X51,Viajes y desplazamientos
E56,Otras deficiencias de vitaminas
H05,Trastornos de la órbita
Y53,Efectos adversos de agentes que afectan primariamente el sistema gastrointestinal
G57,Mononeuropatías del miembro inferior
R74,Nivel anormal de enzimas en suero
R80,Proteinuria aislada
E32,Enfermedades del timo
M12,Otras artropatías específicas
R77,Otras anormalidades de las proteínas plasmáticas
J63,Neumoconiosis debida a otros polvos inorgánicos
M42,Osteocondrosis de la columna vertebral
M40,Cifosis y lordosis
L83,Acantosis nigricans
A95,Fiebre amarilla
A08,Infecciones intestinales debidas a virus y otros organismos especificados
L72,Quiste folicular de la piel y del tejido subcutáneo
K11,Enfermedades de las glándulas salivales
W75,Sofocación y estrangulamiento accidental en la cama
Y56,"Efectos adversos de agentes tópicos que afectan primariamente la piel y las membranas mucosas, y drogas oftalmológicas, otorrinolaringológicas y dentales"
E61,Deficiencias de otros elementos nutricionales
E26,Hiperaldosteronismo
H65,Otitis media no supurativa
B08,"Otras infeciones víricas caracterizadas por lesiones de la piel y de las membranas mucosas, no clasificadas en otra parte"
A07,Otras enfermedades intestinales debidas a protozoarios
B47,Micetoma
A26,Erisipeloide
F59,"Síndromes del comportamiento asociados con alteraciones fisiológicas y factores físicos, no especificados"
J31,"Rinitis, rinofaringitis y faringitis crónicas"
A51,Sífilis precoz
A74,Otras enfermedades causadas por clamidias
A92,Otras fiebres virales transmitidas por mosquitos
B09,"Infección viral no especificada, caracterizada por lesiones de la piel y de las membranas mucosas"
Y51,Efectos adversos de drogas que afectan primariamente el sistema nervioso autónomo
Y63,Falla en la dosificación durante la atención médica y quirúrgica
Q40,Otras malformaciones congénitas de la parte superior del tubo digestivo
Q41,"Ausencia, atresia y estenosis congénita del intestino delgado"
B30,Conjuntivitis viral
B35,Dermatofitosis
B92,Secuelas de lepra
H15,Trastornos de la esclerótica
R26,Anormalidades de la marcha y de la movilidad
R43,Trastornos del olfato y del gusto
L25,"Dermatitis de contacto, forma no especificada"
L44,Otros trastornos papuloescamosos
L58,Radiodermatitis
L66,Alopecia cicatricial [pérdida cicatricial del pelo]
Q30,Malformaciones congénitas de la nariz
M65,Sinovitis y tenosinovitis
M66,Ruptura espontánea de la sinovia y del tendón
V01,Peatón lesionado por colisión con vehículo de pedal
P52,Hemorragia intracraneal no traumática del feto y del recién nacido
P22,Dificultad respiratoria del recién nacido
P36,Sepsis bacteriana del recién nacido
P25,"Enfisema intersticial y afecciones relacionadas, originadas en el período perinatal"
P96,Otras afecciones originadas en el período perinatal
P20,Hipoxia intrauterina
P05,Retardo del crecimiento fetal y desnutrición fetal
P07,"Trastornos relacionados con duración corta de la gestación y con bajo peso al nacer, no clasificados en otra parte"
P56,Hidropesía fetal debida a enfermedad hemolítica
P28,"Otros problemas respiratorios del recién nacido, originados en el período perinatal"
P24,Síndromes de aspiración neonatal
P29,Trastornos cardiovasculares originados en el período perinatal
P83,Otras afecciones de la piel especificas del feto y del recién nacido
P60,Coagulación intravascular diseminada en el feto y el recién nacido
P54,Otras hemorragias neonatales
P39,Otras infecciones especificas del período perinatal
P13,Traumatismo del esqueleto durante el nacimiento
P38,Onfalitis del recién nacido con o sin hemorragia leve
P08,Trastornos relacionados con el embarazo prolongado y con sobrepeso al nacer
P15,Otros traumatismos del nacimiento
P55,Enfermedad hemolítica del feto y del recién nacido
P61,Otros trastornos hematológicos perinatales
P11,Otros traumatismos del nacimiento en el sistema nervioso central
P12,Traumatismo del nacimiento en el cuero cabelludo
P76,Otras obstrucciones intestinales del recién nacido
P35,Enfermedades virales congénitas
P53,Enfermedad hemorrágica del feto y del recién nacido
P80,Hipotermia del recién nacido
Q38,"Otras malformaciones congénitas de la lengua, de la boca y de la faringe"
W66,Ahogamiento y sumersión consecutivos a caída en la bañera
P57,Kernicterus
Q84,Otras malformaciones congénitas de las faneras
P92,Problemas de la ingestión de alimentos del recién nacido
H74,Otros trastornos del oído medio y de la apófisis mastoides
Q73,Defectos por reducción de miembro no especificado
P50,Pérdida de sangre fetal
P58,Ictericia neonatal debida a otras hemólisis excesivas
E40,Kwashiorkor
P14,Traumatismo del sistema nervioso periférico durante el nacimiento
A28,"Otras enfermedades zoonóticas bacterianas, no clasificadas en otra parte"
P81,Otras alteraciones de la regulación de la temperatura en el recién nacido
Q14,Malformaciones congénitas del segmento posterior del ojo
M91,Osteocondrosis juvenil de la cadera y de la pelvis
B60,"Otras enfermedades debidas a protozoarios, no clasificadas en otra parte"
B06,Rubéola [sarampión alemán]
X32,Exposición a rayos solares
B42,Esporotricosis
X35,Víctima de erupción volcánica
O29,Complicaciones de la anestesia administrada durante el embarazo
V76,Ocupante de autobús lesionado por colisión con otros vehículos sin motor
L71,Rosásea
Y76,Dispositivos ginecológicos y obstétricos asociados con incidentes adversos
B68,Teniasis
W60,"Contacto traumático con aguijones, espinas u hojas cortantes de plantas"
R51,Cefalea
M20,Deformidades adquiridas de los dedos de la mano y del pie
R14,Flatulencia y afecciones afines
R35,Poliuria
A77,Fiebre maculosa [rickettsiosis transmitida por garrapatas]
H60,Otitis externa
H49,Estrabismo paralítico
L11,Otros trastornos acantolíticos
E28,Disfunción ovárica
L75,Trastornos sudoríparos apocrinos
R33,Retención de orina
E01,Trastornos tiroideos vinculados a deficiencia de yodo y afecciones relacionadas
R84,Hallazgos anormales en muestras tomadas de órganos respiratorios y torácicos
F18,Trastornos mentales y del comportamiento debidos al uso de disolventes volátiles
R42,Mareo y desvanecimiento
R89,"Hallazgos anormales en muestras tomadas de otros órganos, sistemas y tejidos"
M21,Otras deformidades adquiridas de los miembros
Q54,Hipospadias
X52,Permanencia prolongada en ambiente sin gravedad
L63,Alopecia areata
J18,"Neumonía, organismo no especificado"
D69,Púrpura y otras afecciones hemorrágicas
I07,Enfermedades reumáticas de la válvula tricúspide
I50,Insuficiencia cardíaca
I42,Cardiomiopatía
X70,"Lesión autoinfligida intencionalmente por ahorcamiento, estrangulamiento o sofocación"
W84,Obstrucción no especificada de la respiración
V49,"Ocupante de automóvil lesionado en otros accidentes de transporte, y en los no especificados"
I27,Otras enfermedades cardiopulmonares
X93,Agresión con disparo de arma corta
W70,Ahogamiento y sumersión posterior a caída en aguas naturales
R64,Caquexia
J69,Neumonitis debida a sólidos y líquidos
E43,"Desnutrición proteicocalórica severa, no especificada"
I33,Endocarditis aguda y subaguda
G00,"Meningitis bacteriana, no clasificada en otra parte"
C95,Leucemia de células de tipo no especificado
K75,Otras enfermedades inflamatorias del hígado
Y34,"Evento no especificado, de intención no determinada"
C24,Tumor maligno de otras partes y de las no especificadas de las vías biliares
E46,"Desnutrición proteicocalórica, no especificada"
X59,Exposición a factores no especificados
E14,"Diabetes mellitus, no especificada"
C49,Tumor maligno de otros tejidos conjuntivos y de tejidos blandos
Q03,Hidrocéfalo congénito
R98,Muerte sin asistencia
I60,Hemorragia subaracnoidea
C80,Tumor maligno de sitios no especificados
V89,"Accidente de vehículo de motor o sin motor, tipo de vehículo no especificado"
V48,Ocupante de automóvil lesionado en accidente de transporte sin colisión
C22,Tumor maligno del hígado y de las vías biliares intrahepáticas
C92,Leucemia mieloide
W87,Exposición a corriente eléctrica no especificada
W73,Otros ahogamientos y sumersiones especificados
C56,Tumor maligno del ovario
J96,"Insuficiencia respiratoria, no clasificada en otra parte"
V02,Peatón lesionado por colisión con vehículo de motor de dos o tres ruedas
V27,Motociclista lesionado por colisión con objeto fijo o estacionado
Y28,"Contacto traumático con objeto cortante, de intención no determinada"
I26,Embolia pulmonar
V04,Peatón lesionado por colisión con vehículo de transporte pesado o autobús
R02,"Gangrena, no clasificada en otra parte"
M35,Otro compromiso sistémico del tejido conjuntivo
B20,"Enfermedad por virus de la inmunodeficiencia humana [VIH], resultante en enfermedades infecciosas y parasitarias"
V47,Ocupante de automóvil lesionado por colisión con objeto fijo o estacionado
C16,Tumor maligno del estómago
J98,Otros trastornos respiratorios
V05,Peatón lesionado por colisión con tren o vehículo de rieles
K22,Otras enfermedades del esófago
C26,Tumor maligno de otros sitios y de los mal definidos de los órganos digestivos
G04,"Encefalitis, mielitis y encefalomielitis"
V95,"Accidente de aeronave de motor, con ocupante lesionado"
N18,Enfermedad renal crónica
B22,"Enfermedad por virus de la inmunodeficiencia humana [VIH], resultante en otras enfermedades especificadas"
W34,"Disparo de otras armas de fuego, y las no especificadas"
K57,Enfermedad diverticular del intestino
C53,Tumor maligno del cuello del útero
X61,"Envenenamiento autoinfligido intencionalmente por, y exposición a drogas antiepilépticas, sedantes, hipnóticas, antiparkinsonianas y psicotrópicas, no clasificadas en otra parte"
C18,Tumor maligno del colon
E10,Diabetes mellitus insulinodependiente
I24,Otras enfermedades isquémicas agudas del corazón
E75,Trastornos del metabolismo de los esfingolípidos y otros trastornos por almacenamiento de lípidos
B24,"Enfermedad por virus de la inmunodeficiencia humana [VIH], sin otra especificación"
V99,Accidente de transporte no especificado
C34,Tumor maligno de los bronquios y del pulmón
I51,Complicaciones y descripciones mal definidas de enfermedad cardíaca
N19,Insuficiencia renal no especificada
J81,Edema pulmonar
A09,Otras gastroenteritis y colitis de origen infeccioso y no especificado
G70,Miastenia gravis y otros trastornos neuromusculares
M41,Escoliosis
B19,"Hepatitis viral, sin otra especificación"
D48,Tumor de comportamiento incierto o desconocido de otros sitios y de los no especificados
I25,Enfermedad isquémica crónica del corazón
I61,Hemorragia intraencefálica
E87,"Otros trastornos de los líquidos, de los electrólitos y del equilibrio ácido-básico"
Y57,"Efectos adversos de otras drogas y medicamentos, y los no especificados"
Y11,"Envenenamiento por, y exposición a drogas antiepilépticas, sedantes, hipnóticas, antiparkinsonianas y psicotrópicas, no clasificadas en otra parte, de intención no determinada"
K72,"Insuficiencia hepática, no clasificada en otra parte"
Y83,"Cirugía y otros procedimientos quirúrgicos como la causa de reacción anormal del paciente o de complicación posterior, sin mención de incidente en el momento de efectuar el procedimiento"
V68,Ocupante de vehículo de transporte pesado lesionado en accidente de transporte sin colisión
I21,Infarto agudo del miocardio
W74,Ahogamiento y sumersión no especificados
C43,Melanoma maligno de la piel
W78,Inhalación de contenidos gástricos
V18,Ciclista lesionado en accidente de transporte sin colisión
O02,Otros productos anormales  de la concepción
C65,Tumor maligno de la pelvis renal
I63,Infarto cerebral
C50,Tumor maligno de la mama
E86,Depleción del volumen
I69,Secuelas de enfermedad cerebrovascular
J45,Asma
Y14,"Envenenamiento por, y exposición a otras drogas, medicamentos y sustancias biológicas, y las no especificadas, de intención no determinada"
C76,Tumor maligno de otros sitios y de los sitios mal definidos
O05,Otro aborto
W05,Caída que implica silla de ruedas
G36,Otras desmielinizaciones diseminadas agudas
X33,Víctima de rayo
N28,"Otros trastornos del riñón y del uréter, no clasificados en otra parte"
G12,Atrofia muscular espinal y síndromes afines
W13,"Caída desde, fuera o a través de un edificio u otra construcción"
Y70,Dispositivos de anestesiología asociados con incidentes adversos
G82,Paraplejía y cuadriplejía
Y89,Secuelas de otras causas externas
G95,Otras enfermedades de la médula espinal
Q90,Síndrome de Down
O06,Aborto no especificado
A16,"Tuberculosis respiratoria, no confirmada bacteriológica o histológicamente"
X68,"Envenenamiento autoinfligido intencionalmente por, y exposición a plaguicidas"
R56,"Convulsiones, no clasificadas en otra parte"
X47,"Envenenamiento accidental por, y exposición a otros gases y vapores"
Y23,"Disparo de rifle, escopeta y arma larga, de intención no determinada"
E64,Secuelas de la desnutrición y de otras deficiencias nutricionales
W19,Caída no especificada
C81,Linfoma de Hodgkin
V28,Motociclista lesionado en accidente de transporte sin colisión
Q05,Espina bífida
G37,Otras enfermedades desmielinizantes del sistema nervioso central
G31,"Otras enfermedades degenerativas del sistema nervioso, no clasificadas en otra parte"
E84,Fibrosis quística
R68,Otros síntomas y signos generales
K85,Pancreatitis aguda
Q04,Otras malformaciones congénitas del encéfalo
C74,Tumor maligno de la glándula suprarrenal
J10,Influenza debida a otro virus de la influenza identificado
K81,Colecistitis
B37,Candidiasis
C69,Tumor maligno del ojo y sus anexos
Y04,Agresión con fuerza corporal
G06,Absceso y granuloma intracraneal e intrarraquídeo
E88,Otros trastornos metabólicos
J16,"Neumonía debida a otros microorganismos infecciosos, no clasificados en otra parte"
Q22,Malformaciones congénitas de la válvulas pulmonar y tricúspide
F29,"Psicosis de origen no orgánico, no especificada"
D61,Otras anemias aplásticas
Y25,"Contacto traumático con material explosivo, de intención no determinada"
G96,Otros trastornos del sistema nervioso central
L93,Lupus eritematoso
D65,Coagulación intravascular diseminada [síndrome de desfibrinación]
E66,Obesidad
C84,Linfomas de células T/NK maduras
Q44,"Malformaciones congénitas de la vesícula biliar, de los conductos biliares y del hígado"
Y29,"Contacto traumático con objeto romo o sin filo, de intención no determinada"
V54,Ocupante de camioneta o furgoneta lesionado por colisión con vehículo de transporte pesado o autobús
C70,Tumor maligno de las meninges
D72,Otros trastornos de los leucocitos
K25,Úlcera gástrica
G98,"Otros trastornos del sistema nervioso, no clasificados en otra parte"
K50,Enfermedad de Crohn [enteritis regional]
N05,Síndrome nefrítico no especificado
J39,Otras enfermedades de las vías respiratorias superiores
C17,Tumor maligno del intestino delgado
B21,"Enfermedad por virus de la inmunodeficiencia humana [VIH], resultante  en tumores malignos"
G91,Hidrocéfalo
O15,Eclampsia
W79,Inhalación e ingestión de alimento que causa obstrucción de las vías respiratorias
D23,Otros tumores benignos de la piel
C44,Otros tumores malignos de la piel
K51,Colitis Ulcerativa
I38,"Endocarditis, válvula no especificada"
B44,Aspergilosis
G09,Secuelas de enfermedades inflamatorias del sistema nervioso central
C40,Tumor maligno de los huesos y de los cartílagos articulares de los miembros
Y31,"Caída, permanencia o carrera delante o hacia objeto en movimiento, de intención no determinada"
W85,Exposición a líneas de transmisión eléctrica
Y08,Agresión por otros medios especificados
C14,"Tumor maligno de otros sitios y de los mal definidos del labio, de la cavidad bucal y de la faringe"
O26,Atención a la madre por otras complicaciones principalmente relacionadas con el embarazo
X00,Exposición a fuego no controlado en edificio u otra construcción
X96,Agresión con material explosivo
X97,"Agresión con humo, fuego y llamas"
Y18,"Envenenamiento por, y exposición a plaguicidas, de intención no determinada"
I72,Otros aneurismas y aneurismas disecantes
N39,Otros trastornos del sistema urinario
J46,Estado asmático
K83,Otras enfermedades de las vías biliares
Y33,"Otros eventos especificados, de intención no determinada"
Q28,Otras malformaciones congénitas del sistema circulatorio
D44,Tumor de comportamiento incierto o desconocido de las glándulas endocrinas
F79,"Retraso mental, no especificado"
O45,Desprendimiento prematuro de la placenta [Abruptio placentae]
L98,Otros trastornos de la piel y del tejido subcutáneo no clasificados en otra parte
D76,Otras enfermedades especificadas con participación deL tejido linforreticular y del tejido reticulohistiocítico
W14,Caída desde un árbol
V12,Ciclista lesionado por colisión con vehículo de motor de dos o tres ruedas.
X06,Exposición a ignición o fusión de otras ropas y accesorios
F84,Trastornos generalizados del desarrollo
X85,"Agresión con drogas, medicamentos y sustancias biológicas"
R40,"Somnolencia, estupor y coma"
B46,Cigomicosis
F99,"Trastorno mental, no especificado"
V13,"Ciclista lesionado por colisión con automóvil, camioneta o furgoneta"
K59,Otros trastornos funcionles del intestino
G11,Ataxia hereditaria
X89,Agresión con otros productos químicos y sustancias nocivas especificadas
D64,Otras anemias
A17,Tuberculosis del sistema nervioso
E20,Hipoparatiroidismo
O72,Hemorragia postparto
I77,Otros trastornos arteriales o arteriolares
J20,Bronquitis aguda
E23,Hipofunción y otros trastornos de la glándula hipófisis
K60,Fisura y fístula de las regiones anal y rectal
Q67,"Deformidades osteomusculares congénitas de la cabeza, de la cara, de la columna vertebral y del tórax"
E85,Amiloidosis
I62,Otras hemorragias intracraneales no traumáticas
B17,Otras hepatitis virales agudas
Q20,Malformaciones congénitas de las cámaras cardíacas y sus conexiones
Q99,"Otras anomalías cromosómicas, no clasificadas en otra parte"
A18,Tuberculosis de otros órganos
Q02,Microcefalia
O86,Otras infecciones puerperales
G21,Parkinsonismo secundario
O87,Complicaciones venosas y hemorroides en el puerperio
J43,Enfisema
R00,Anormalidades del latido cardíaco
V45,Ocupante de automóvil lesionado por colisión con tren o vehículo de rieles
J85,Absceso del pulmón y del mediastino
O88,Embolia obstétrica
K20,Esofagitis
M31,Otras vasculopatías necrotizantes
W30,Contacto traumático con maquinaria agrícola
Q33,Malformaciones congénitas del pulmón
C63,Tumor maligno de otros órganos genitales maculinos y de los no especificados
K21,Enfermedad del reflujo gastroesofágico
