codigo,clasificacion
K56,Ileo paralítico y obstrucción intestinal sin hernia
W31,"Contacto traumático con otras maquinarias, y las no especificadas"
X95,"Agresión con disparo de otras armas de fuego, y las no especificadas"
G93,Otros trastornos del encéfalo
V43,"Ocupante de automóvil lesionado por colisión con otro automóvil, camioneta o furgoneta"
Y09,Agresión por medios no especificados
V23,"Motociclista lesionado por colisión con automóvil, camioneta o furgoneta"
X74,"Lesión autoinfligida intencionalmente por disparo de otras armas de fuego, y las no especificadas"
Q89,"Otras malformaciones congénitas, no clasificadas en otra parte"
I49,Otras arritmias cardiacas
Y21,"Ahogamiento y sumersión, de intención no determinada"
X78,Lesión autoinfligida intencionalmente por objeto cortante
O96,Muerte materna debida a cualquier causa obstétrica que ocurre después de 42 días pero antes de un año del parto
C85,Linfoma no Hodgkin de otro tipo y el no especificado
K92,Otras enfermedades del sistema digestivo
I99,Otros trastornos y los no especificados del sistema circulatorio
W32,Disparo de arma corta
V29,"Motociclista lesionado en otros accidentes de transporte, y en los no especificados"
X99,Agresión con objeto cortante
C91,Leucemia linfoide
C41,"Tumor maligno de los huesos y de los cartílagos articulares, de otros sitios y de sitios no especificados"
I67,Otras enfermedades cerebrovasculares
C97,Tumores malignos (primarios) de sitios múltiples independientes
D14,Tumor benigno del oído medio y del sistema respiratorio
Y20,"Ahorcamiento, estrangulamiento y sofocación, de intención no determinada"
Q80,Ictiosis congénita
J15,"Neumonía bacteriana, no clasificada en otra parte"
Y24,"Disparo de otras armas de fuego, y las no especificadas, de intención no determinada"
G80,Parálisis cerebral
V14,Ciclista lesionado por colisión con vehículo de transporte pesado o autobús
A41,Otras Sepsis
N25,Trastornos resultantes de la función tubular renal alterada
W33,"Disparo de rifle, escopeta y arma larga"
Y35,Intervención legal
K65,Peritonitis
X09,"Exposición a humos, fuegos o llamas no especificados"
J93,Neumotórax
D43,Tumor de comportamiento incierto o desconocido del encéfalo y del sistema nervioso central
C71,Tumor maligno del encéfalo
B57,Enfermedad de Chagas
M06,Otras artritis reumatoides
W77,"Obstrucción de la respiración debida a hundimiento, caída de tierra u otras sustancias"
R99,Otras causas mal definidas y las no especificadas de mortalidad
G03,Meningitis debida a otras causas y a las no especificadas
C83,Linfoma no folicular
D60,"Aplasia adquirida, exclusiva de la serie roja [eritroblastopenia]"
Q07,Otras malformaciones congénitas del sistema nervioso
G40,Epilepsia
Q24,Otras malformaciones congénitas del corazón
O98,"Enfermedades maternas infecciosas y parasitarias clasificables en otra parte, pero que complican el embarazo, el parto y el puerperio"
K55,Trastornos vasculares de los intestinos
J67,Neumonitis debida a hipersensibilidad al polvo orgánico
A27,Leptospirosis
C55,"Tumor maligno del útero, parte no especificada"
V03,"Peatón lesionado por colisión con automóvil, camioneta o furgoneta"
Y10,"Envenenamiento por, y exposición a analgésicos no narcóticos, antipiréticos y antirreumáticos, de intención no determinada"
G71,Trastornos musculares primarios
Y00,Agresión con objeto romo o sin filo
C61,Tumor maligno de la próstata
V17,Ciclista lesionado por colisión con objeto estacionado o fijo
A30,Lepra [enfermedad de Hansen]
R57,"Choque, no clasificado en otra parte"
M88,Enfermedad de Paget de los huesos [osteítis deformante]
J86,Piotórax
K35,Apendicitis aguda
I47,Taquicardia paroxística
E76,Trastornos del metabolismo de los glucosaminoglicanos
O99,"Otras enfermedades maternas clasificables en otra parte, pero que complican el embarazo, el parto y el puerperio"
X80,Lesión autoinfligida intencionalmente al saltar desde un lugar elevado
Y12,"Envenenamiento por, y exposición a narcóticos y psicodislépticos [alucinógenos], no clasificados en otra parte, de intención no determinada"
Y59,"Efectos adversos de otras vacunas y sustancias biológicas, y las no especificadas"
K76,Otras enfermedades del hígado
M32,Lupus eritematoso sistémico
X94,"Agresión con disparo de rifle, escopeta y arma larga"
O03,Aborto espontáneo
Q21,Malformaciones congénitas de los tabiques cardíacos
X64,"Envenenamiento autoinfligido intencionalmente por, y exposición a otras drogas, medicamentos y sustancias biológicas, y los no especificados"
I85,Várices esofágicas
J22,Infección aguda no especificada de las vías respiratorias inferiores
J44,Otras enfermedades pulmonares obstructivas crónicas
W18,Otras caídas en el mismo nivel
D70,Agranulocitosis
V19,"Ciclista lesionado en otros accidentes de transporte, y en los no especificados."
L08,Otras infecciones locales de la piel y del tejido subcutáneo
B23,"Enfermedad por virus de la inmunodeficiencia humana [VIH], resultante en otras afecciones"
X67,"Envenenamiento autoinfligido intencionalmente por, y exposición a otros gases y vapores"
I64,"Accidente vascular encefálico agudo, no especificado como hemorrágico o isquémico"
R04,Hemorragia de las vías respiratorias
V24,Motociclista lesionado por colisión con vehículo de transporte pesado o autobús
Y22,"Disparo de arma corta, de intención no determinada"
A86,"Encefalitis viral, no especificada"
I71,Aneurisma y disección aórticos
C25,Tumor maligno del páncreas
Q43,Otras malformaciones congénitas del intestino
D41,Tumor de comportamiento incierto o desconocido de los órganos urinarios
V53,"Ocupante de camioneta o furgoneta lesionado por colisión con automóvil, camioneta o furgoneta"
B33,"Otras enfermedades virales, no clasificadas en otra parte"
C38,"Tumor maligno del corazón, del mediastino y de la pleura"
A39,Enfermedad meningocócica
W40,Explosión de otros materiales
I10,Hipertensión esencial (primaria)
X81,Lesión autoinfligida intencionalmente por arrojarse o colocarse delante de objeto en movimiento
I35,Trastornos no reumáticos de la válvula aórtica
X71,Lesión autoinfligida intencionalmente por ahogamiento y sumersión
N04,Síndrome nefrótico
V20,Motociclista lesionado por colisión con peatón o animal
M62,Otros trastornos de los músculos
C31,Tumor maligno de los senos paranasales
V09,"Peatón lesionado en otros accidentes de transporte, y en los no especificados"
Y15,"Envenenamiento por, y exposición al alcohol, de intención no determinada"
R96,Otras muertes súbitas de causa desconocida
E79,Trastornos del metabolismo de las purinas y de las pirimidinas
X84,Lesión autoinfligida intencionalmente por medios no especificados
J80,Síndrome de dificultad respiratoria del adulto
V71,Ocupante de autobús lesionado por colisión con vehículo de pedal
V44,Ocupante de automóvil lesionado por colisión con  vehículo de transporte pesado o autobús
X73,"Lesión autoinfligida intencionalmente por disparo de rifle, escopeta y arma larga"
D42,Tumor de comportamiento incierto o desconocido de las meninges
Y17,"Envenenamiento por, y  exposición a otros gases y vapores, de intención no determinada"
D33,Tumor benigno del encéfalo y de otras partes del sistema nervioso central
V21,Motociclista lesionado por colisión con vehículo de pedal
Q81,Epidermólisis bullosa
D16,Tumor benigno del hueso y del cartílago articular
R06,Anormalidades de la respiración
Y26,"Exposición al humo, fuego y llamas, de intención no determinada"
D71,Trastornos funcionales de los polimorfonucleares neutrófilos
O14,Preeclampsia
J11,Influenza debida a virus no identificado
V22,Motociclista lesionado por colisión con vehículo de motor de dos o tres ruedas
Y30,"Caída, salto o empujón desde lugar elevado, de intención no determinada"
V78,Ocupante de autobús lesionado en accidente de transporte sin colisión
W59,Mordedura o aplastamiento por otros reptiles
X72,Lesión autoinfligida intencionalmente por disparo de arma corta
V42,Ocupante de automóvil lesionado por colisión con vehículo de motor de dos o tres ruedas
C47,Tumor maligno de los nervios periféricos y del sistema nervioso autónomo
X69,"Envenenamiento autoinfligido intencionalmente por, y exposición a otros productos químicos y sustancias nocivas, y los no especificados"
C67,Tumor maligno de la vejiga urinaria
C20,Tumor maligno del recto
R09,Otros síntomas y signos que involucran los sistemas circulatorio y respiratorio
I30,Pericarditis aguda
I81,Trombosis de la vena porta
Q87,Otros síndromes de malformaciones congénitas especificados que afectan múltiples sistemas
W68,Ahogamiento y sumersión consecutivos a caída en una piscina
C48,Tumor maligno del peritoneo y del retroperitoneo
M72,Trastornos fibroblásticos
C79,Tumor maligno secundario de otros sitios y de sitios no especificados
D73,Enfermedades del bazo
V80,Jinete u ocupante de vehículo de tracción animal lesionado en accidente de transporte
W69,Ahogamiento y sumersión mientras se está en aguas naturales
Q60,Agenesia renal y otras malformaciones hipoplásicas del riñón
O21,Vómitos excesivos del embarazo
Y07,Otros maltratos
I31,Otras enfermedades del pericardio
C62,Tumor maligno del testículo
V57,Ocupante de camioneta o furgoneta lesionado por colisión objeto fijo o estacionado
I45,Otros trastornos de la conducción
O41,Otros trastornos del líquido amniótico y de las membranas
V81,Ocupante de tren o vehículo de rieles lesionado en accidente de transporte
D75,Otras enfermedades de la sangre y de los órganos hematopoyéticos
B45,Criptococosis
O44,Placenta previa
V58,Ocupante de camioneta o furgoneta lesionado en accidente de transporte sin colisión
K66,Otros trastornos del peritoneo
W17,Otras caídas de un nivel a otro
Y19,"Envenenamiento por, y exposición a otros productos químicos y sustancias nocivas, y los no especificados, de intención no determinada"
C64,"Tumor maligno del riñón, excepto de la pelvis renal"
B58,Toxoplasmosis
I82,Otras embolias y trombosis venosas
V84,Ocupante de vehículo especial (de motor) para uso principalmente en agricultura lesionado en accidente de transporte
J47,Bronquiectasia
W20,"Golpe por objeto arrojado, proyectado o que cae"
W86,Exposición a otras corrientes eléctricas especificadas
M33,Dermatopolimiositis
E72,Otros trastornos del metabolismo de los aminoácidos
G10,Enfermedad de Huntington
I34,Trastornos no reumáticos de la válvula mitral
K74,Fibrosis y cirrosis del hígado
W15,Caída desde peñasco
X90,Agresión con productos químicos y sustancias nocivas no especificadas
C75,Tumor maligno de otras glándulas endocrinas y de estructuras afines
X91,"Agresión por ahorcamiento, estrangulamiento y sofocación"
V87,Accidente de tránsito de tipo especificado pero donde se desconoce el modo de transporte de la víctima
N49,"Trastornos inflamatorios de órganos genitales masculinos, no clasificados en otra parte"
D82,Inmunodeficiencia asociada con otros defectos mayores
W16,Salto o zambullida dentro del agua que causa otro traumatismo sin sumersión o ahogamiento
Q93,"Monosomías y supresiones de los autosomas, no  clasificadas en otra parte"
D83,Inmunodeficiencia variable común
M00,Artritis piógena
D84,Otras inmunodeficiencias
J90,Derrame pleural no clasificado en otra parte
Q64,Otras malformaciones congénitas del sistema urinario
E11,Diabetes mellitus no insulinodependiente
I46,Paro cardíaco
W23,"Atrapado, aplastado, trabado o apretado en o entre objetos"
O85,Sepsis puerperal
N17,Insuficiencia renal aguda
W80,Inhalación e ingestión de otros objetos que causan obstrucción de las vías respiratorias
E25,Trastornos adrenogenitales
C90,Mieloma múltiple y tumores malignos de células plasmáticas
C72,"Tumor maligno de la médula espinal, de los nervios craneales y de otras partes del sistema nervioso central"
R58,"Hemorragia, no clasificada en otra parte"
M34,Esclerosis sistémica
N15,Otras enfermedades renales tubulointersticiales
A49,Infección bacteriana de sitio no especificado
X75,Lesión autoinfligida intencionalmente por material explosivo
L89,Úlcera de decúbito
X76,"Lesión autoinfligida intencionalmente por humo, fuego y llamas"
R10,Dolor abdominal y pélvico
D86,Sarcoidosis
V59,"Ocupante de camioneta o furgoneta lesionado en otros accidentes de transporte, y en los no especificados"
M86,Osteomielitis
D40,Tumor de comportamiento incierto o desconocido de los órganos genitales masculinos
V46,Ocupante de automóvil lesionado por colisión con otros vehículos sin motor
A19,Tuberculosis miliar
I12,Enfermedad renal hipertensiva
C96,"Otros tumores malignos y los no especificados del tejido linfático, de los órganos hematopoyéticos y de tejidos afines"
X02,Exposición a fuego controlado en edificio u otra construcción
D58,Otras anemias hemolíticas hereditarias
X04,Exposición a ignición de material altamente inflamable
D59,Anemia hemolítica adquirida
O95,Muerte obstétrica de causa no especificada
V90,Accidente de embarcación que causa ahogamiento y sumersión
Q78,Otras osteocondrodisplasias
V26,Motociclista lesionado por colisión con otros vehículos sin motor
C05,Tumor maligno del paladar
K80,Colelitiasis
I44,Bloqueo auriculoventricular y de rama izquierda del haz
V64,Ocupante de vehículo de transporte pesado lesionado por colisión con otro vehículo de transporte pesado o autobús
F10,Trastornos mentales y del comportamiento debidos al uso de alcohol
V92,"Ahogamiento y sumersión relacionados con transporte por agua, sin accidente a la embarcación"
X49,"Envenenamiento accidental por, y exposición a otros productos químicos y sustancias nocivas, y los no especificados"
E74,Otros trastornos del metabolismo de los carbohidratos
J84,Otras enfermedades pulmonares intersticiales
V97,Otros accidentes de transporte aéreo especificados
C78,Tumor maligno secundario de los órganos respiratorios y digestivos
C11,Tumor maligno de la nasofaringe
K70,Enfermedad alcohólica del hígado
I08,Enfermedades valvulares múltiples
O00,Embarazo ectópico
I09,Otras enfermedades reumáticas del corazón
A35,Otros tétanos
C30,Tumor maligno de las fosas nasales y del oído medio
D32,Tumores benignos de las meninges
D68,Otros defectos de la coagulación
V50,Ocupante de camioneta o furgoneta lesionado por colisión con peatón o animal
E78,Trastornos del metabolismo de las lipoproteínas y otras lipidemias
X37,Víctima de tormenta cataclísmica
G83,Otros síndromes paralíticos
X42,"Envenenamiento accidental por, y exposición a narcóticos y psicodislépticos [alucinógenos], no clasificados en otra parte"
Y01,Agresión por empujón desde un lugar elevado
E71,Trastornos del metabolismo de los aminoácidos de cadena ramificada y de los ácidos grasos
V73,"Ocupante de autobús lesionado por colisión con automóvil, camioneta o furgoneta"
A98,"Otras fiebres virales hemorrágicas, no clasificadas en otra parte"
X46,"Envenenamiento accidental por, y exposición a disolventes orgánicos e hidrocarburos halogenados y sus vapores"
Q85,"Facomatosis, no clasificada en otra parte"
V79,"Ocupante de autobús lesionado en otros accidentes de transporte, y en los no especificados"
A15,"Tuberculosis respiratoria, confirmada bacteriológica e histológicamente"
K71,Enfermedad tóxica del hígado
B01,Varicela
M08,Artritis juvenil
L02,"Absceso cutáneo, furúnculo y ántrax"
C93,Leucemia monocítica
N12,"Nefritis tubulointersticial, no especificada como aguda o crónica"
C94,Otras leucemias de tipo celular especificado
V83,Ocupante de vehículo especial (de motor) para uso principalmente en plantas industriales lesionado en accidente de transporte
O90,"Complicaciones del puerperio, no clasificadas en otra parte"
X98,"Agresión con vapor de agua, vapores y objetos calientes"
I05,Enfermedades reumáticas de la válvula mitral
B67,Equinococosis
L03,Celulitis
O71,Otro trauma obstétrico
V86,Ocupante de vehículo especial para todo terreno o de otro vehículo de motor para uso fuera de la carretera lesionado en accidente de transporte
D81,Inmunodeficiencias combinadas
C60,Tumor maligno del pene
D36,Tumor benigno de otros sitios y de los no especificados
R41,Otros síntomas y signos que involucran la función cognoscitiva y la conciencia
K86,Otras enfermedades del páncreas
W24,"Contacto traumático con dispositivos de elevación o transmisión, no clasificado en otra parte"
E34,Otros trastornos endocrinos
N71,"Enfermedad inflamatoria del útero, excepto del cuello uterino"
W29,"Contacto traumático con otras herramientas manuales y artefactos del hogar, con motor"
X48,"Envenenamiento accidental por, y exposición a plaguicidas"
V25,Motociclista lesionado por colisión con tren o vehículo de rieles
X20,Contacto traumático con serpientes y lagartos venenosos
X21,Contacto traumático con arañas venenosas
V63,"Ocupante de vehículo de transporte pesado lesionado por colisión con automóvil, camioneta o furgoneta"
L04,Linfadenitis aguda
Y84,"Otros procedimientos médicos como la causa de reacción anormal del paciente o de complicación posterior, sin mención de incidente en el momento de efectuar el procedimiento"
D46,Síndromes mielodisplásicos
N27,Riñón pequeño de causa desconocida
A52,Sífilis tardía
N92,"Menstruación excesiva, frecuente e irregular"
J03,Amigdalitis aguda
M43,Otras dorsopatías deformantes
I80,Flebitis y tromboflebitis
Y88,Secuelas con atención médica y quirúrgica como causa externa
C06,Tumor maligno de otras partes y de las no especificadas de la boca
M13,Otras artritis
X36,"Víctima de avalancha, derrumbe y otros movimientos de tierra"
C73,Tumor maligno de la glándula tiroides
D89,"Otros trastornos que afectan el mecanismo de la inmunidad, no clasificados en otra parte"
Q79,"Malformaciones congénitas del sistema osteomuscular, no clasificadas en otra parte"
V70,Ocupante de autobús lesionado por colisión con peatón o animal
A90,Fiebre del dengue [dengue clásico]
X44,"Envenenamiento accidental por, y exposición a otras drogas, medicamentos y sustancias biológicas, y los no especificados"
F20,Esquizofrenia
A40,Sepsis estreptocócica
V34,Ocupante de vehículo de motor de tres ruedas lesionado por colisión con vehículo de transporte pesado o autobús
B00,Infecciones herpética [herpes simple]
X45,"Envenenamiento accidental por, y exposición al alcohol"
W55,Mordedura o ataque de otros mamíferos
V40,Ocupante de automóvil lesionado por colisión con peatón o animal
X83,Lesión autoinfligida intencionalmente por otros medios especificados
L10,Pénfigo
B41,Paracoccidioidomicosis
G58,Otras mononeuropatías
J70,Afecciones respiratorias debidas a otros agentes externos
C07,Tumor maligno de la glándula parótida
V55,Ocupante de camioneta o furgoneta lesionado por colisión con tren o vehículo de rieles
K12,Estomatitis y lesiones afines
O67,"Trabajo de parto y parto complicados por hemorragia intraparto, no clasificados en otra parte"
O69,Trabajo de parto y parto complicados por problemas del cordón umbilical
X87,Agresión con plaguicidas
K44,Hernia diafragmática
Q06,Otras malformaciones congénitas de la médula espinal
E21,Hiperparatiroidismo y otros trastornos de la glándula paratiroides
B78,Estrongiloidiasis
Q96,Síndrome de Turner
O73,"Retención de la placenta o de las membranas, sin hemorragia"
B87,Miasis
Q76,Malformaciones congénitas de la columna vertebral y tórax óseo
B25,Enfermedad debida a virus citomegálico
N73,Otras enfermedades pélvicas inflamatorias femeninas
N76,Otras afecciones inflamatorias de la vagina y de la vulva
L92,Trastornos granulomatosos de la piel y del tejido subcutáneo
C00,Tumor maligno del labio
Y44,Efectos adversos de agentes que afectan primariamente los constituyentes de la sangre
X31,Exposición al frío natural excesivo
Y47,"Efectos adversos de drogas sedantes, hipnóticas y ansiolíticas"
W10,Caída en o desde escalera o escalones
K73,"Hepatitis crónica, no clasificada en otra parte"
W11,Caída en o desde escalera manuales
N32,Otros trastornos de la vejiga
V74,Ocupante de autobús lesionado por colisión con vehículo de transporte pesado o autobús
W22,Golpe contra o golpeado por otros objetos
E27,Otros trastornos  de la glándula suprarrenal
Q26,Malformaciones congénitas de las grandes venas
C54,Tumor maligno del cuerpo del útero
Q27,Otras malformaciones congénitas del sistema vascular periférico
Q61,Enfermedad quística del riñón
C57,Tumor maligno de otros órganos genitales femeninos y de los no especificados
G41,Estado de mal epiléptico
J64,"Neumoconiosis, no especificada"
A50,Sífilis congénita
C86,Otros tipos especificados de linfoma de células T/NK
W21,Golpe contra o golpeado por equipo para deportes
Q12,Malformaciones congénitas del cristalino
K62,Otras enfermedades del ano y del recto
F03,"Demencia , no especificada"
X22,Contacto traumático con escorpión
X82,Lesión autoinfligida intencionalmente por colisión de vehículo de motor
X50,Exceso de esfuerzo y movimientos extenuantes y repetitivos
K26,Úlcera duodenal
W67,Ahogamiento y sumersión mientras se está en una piscina
W00,Caída en el mismo nivel por hielo o nieve
W35,Explosión y rotura de caldera
X11,Contacto con agua caliente corriente
X13,Contacto con vapor de agua y otros vapores calientes
R55,Síncope y colapso
H16,Queratitis
R94,Resultados anormales de estudios funcionales
R29,Otros síntomas y signos que involucran los sistemas nervioso y osteomuscular
D12,"Tumor benigno del colon, del recto, del conducto anal y del ano"
C82,Linfoma folicular
K37,"Apendicitis, no especificada"
I78,Enfermedades de los vasos capilares
I37,Trastornos de la válvula pulmonar
O22,Complicaciones venosas y hemorroides en el embarazo
X92,Agresión por ahogamiento y sumersión
W25,Contacto traumático con vidrio cortante
X15,Contacto con utensilios domésticos calientes
C04,Tumor maligno del piso de la boca
L12,Penfigoide
Y50,"Efectos adversos de estimulantes del sistema nervioso central, no clasificados en otra parte"
X66,"Envenenamiento autoinfligido intencionalmente por, y exposición a disolventes orgánicos e hidrocarburos halogenados y sus vapores"
J38,"Enfermedades de las cuerdas vocales y de la laringe, no clasificadas en otra parte"
F14,Trastornos mentales y del comportamiento debidos al uso de cocaína
K27,"Úlcera péptica, de sitio no especificado"
O36,Atención materna por otros problemas fetales conocidos o presuntos
J12,"Neumonía viral, no clasificada en otra parte"
Y43,Efectos adversos de agentes sistémicos primarios
O01,Mola hidatiforme
X12,Contacto con otros líquidos calientes
M30,Poliarteritis nudosa y afecciones relacionadas
Y32,"Colisión de vehículo de motor, de intención no determinada"
X63,"Envenenamiento autoinfligido intencionalmente por, y exposición a otras drogas que actúan sobre el sistema nervioso autónomo"
G24,Distonía
X53,Privación de alimentos
O43,Trastornos placentarios
O25,Desnutrición en el embarazo
V96,"Accidente de aeronave sin motor, con ocupante lesionado"
F34,Trastorno del humor [afectivos] persistentes
R65,Síndrome de respuesta inflamatoria sistémica
V65,Ocupante de vehículo de transporte pesado lesionado por colisión con tren o vehículo de rieles
O10,"Hipertensión preexistente que complica el embarazo, el parto y el puerperio"
C52,Tumor maligno de la vagina
I00,Fiebre reumática sin mención de complicación cardíaca
N02,Hematuria recurrente y persistente
W38,Explosión y rotura de otros dispositivos presurizados especificado
B39,Histoplasmosis
W45,Cuerpo extraño que penetra a través de la piel
W64,"Exposición a otras fuerzas mecánicas animadas, y las no especificadas"
E07,Otros trastornos tiroideos
F11,Trastornos mentales y del comportamiento debidos al uso de opiáceos
V62,Ocupante de vehículo de transporte pesado lesionado por colisión con vehículo de motor de dos o tres ruedas
C01,Tumor maligno de la base de la lengua
K29,Gastritis y duodenitis
I74,Embolia y trombosis arteriales
V37,Ocupante de vehículo de motor de tres ruedas lesionado por  colisión con objeto fijo o estacionado
W54,Mordedura o ataque de perro
L53,Otras afecciones eritematosas
W51,Choque o empellón contra otra persona
Q77,Osteocondrodisplasia con defecto del crecimiento de los huesos largos y de la columna vertebral
R82,Otros hallazgos anormales en la orina
D13,Tumor benigno de otras partes y de las mal definidas del sistema digestivo
F48,Otros trastornos neuróticos
A01,Fiebres tifoidea y paratifoidea
C68,Tumor maligno de otros óganos urinarios y de los no especificados
Q65,Deformidades congénitas de la cadera
W81,Confinado o atrapado en un ambiente con bajo contenido de oxígeno
O60,Parto prematuro
B38,Coccidioidomicosis
D18,Hemangioma y linfangioma de cualquier sitio
C09,Tumor maligno de la amígdala
C51,Tumor maligno de la vulva
Q91,Síndrome de Edwards y síndrome  de Patau
O66,Otras obstrucciones del trabajo de parto
W57,Mordedura o picadura de insectos y otros artrópodos no venenosos
D21,Otros tumores benignos del tejido conjuntivo y de los tejidos blandos
X19,"Contacto con otras sustancias calientes, y las no especificadas"
M45,Espondilitis anquilosante
A31,Infecciones debidas a otras micobacterias
H66,Otitis media supurativa y la no especificada
G30,Enfermedad de Alzheimer
C08,Tumor maligno de otras glándulas salivales mayores y de las no especificadas
E22,Hiperfunción de la glándula hipófisis
G72,Otras miopatías
R07,Dolor de garganta y en el pecho
B65,Esquistosomiasis [bilharziasis]
M18,Artrosis de la primera articulación carpometacarpiana
G92,Encefalopatía tóxica
J42,Bronquitis crónica no especificada
O20,Hemorragia precoz del embarazo
K42,Hernia umbilical
N64,Otros trastornos de la mama
A32,Listeriosis
D05,Carcinoma in situ de la mama
D10,Tumor benigno de la boca y de la faringe
N30,Cistitis
F71,Retraso mental moderado
M79,"Otros trastornos de los tejidos blandos, no clasificados en otra parte"
G23,Otras enfermedades degenerativas de los núcleos de la base
